{
  "$schema": "./manifest-fragment.schema.json",
  "schemaVersion": 1,
  "issue": 45,
  "sourceContract": {
    "path": "issue-38/content/world_r1_r6.json",
    "sha256": "f8922a8ce4d98d01f19477a38b7bb3291c52b20914576a4231067e635818338a"
  },
  "generationLog": {
    "path": "art-source/issue-45-r5-r6/generation-log.json",
    "sha256": "5ddc827ffdf9ff8f875cca0fdeb86a13e23e6829fc320a6a1f45590f32172dbe"
  },
  "regions": [
    {
      "id": "r05",
      "nameKo": "궤도 잔해권",
      "paletteFile": "art-source/issue-45-r5-r6/palettes/r05_orbit16.gpl",
      "paletteAnchors": [
        "#090B1A",
        "#4A4E9B",
        "#8C6ED9",
        "#D8F3FF"
      ],
      "eliteStageAllocation": [
        {
          "localStage": 5,
          "globalStage": 245,
          "entityId": "docking_golem"
        },
        {
          "localStage": 15,
          "globalStage": 255,
          "entityId": "dish_starfish"
        },
        {
          "localStage": 25,
          "globalStage": 265,
          "entityId": "docking_golem"
        },
        {
          "localStage": 35,
          "globalStage": 275,
          "entityId": "dish_starfish"
        },
        {
          "localStage": 45,
          "globalStage": 285,
          "entityId": "docking_golem"
        },
        {
          "localStage": 55,
          "globalStage": 295,
          "entityId": "dish_starfish"
        }
      ]
    },
    {
      "id": "r06",
      "nameKo": "버려진 달 도시와 기계 행성",
      "paletteFile": "art-source/issue-45-r5-r6/palettes/r06_civilization16.gpl",
      "paletteAnchors": [
        "#17121F",
        "#6B5B3E",
        "#D9B44A",
        "#E45A9D"
      ],
      "eliteStageAllocation": [
        {
          "localStage": 5,
          "globalStage": 305,
          "entityId": "time_compressor"
        },
        {
          "localStage": 15,
          "globalStage": 315,
          "entityId": "memory_incinerator_librarian"
        },
        {
          "localStage": 25,
          "globalStage": 325,
          "entityId": "time_compressor"
        },
        {
          "localStage": 35,
          "globalStage": 335,
          "entityId": "memory_incinerator_librarian"
        },
        {
          "localStage": 45,
          "globalStage": 345,
          "entityId": "time_compressor"
        },
        {
          "localStage": 55,
          "globalStage": 355,
          "entityId": "memory_incinerator_librarian"
        }
      ]
    }
  ],
  "assets": [
    {
      "id": "enemy_r05_panel_butterfly",
      "regionId": "r05",
      "entityId": "panel_butterfly",
      "nameKo": "패널나비",
      "nameEn": "Panel Butterfly",
      "class": "normal",
      "kind": "enemy_medium",
      "behaviorId": "solar_reflect",
      "behaviorKo": "태양 패널 반사",
      "weakness": "cooling",
      "secondaryWeaknesses": [],
      "breakSequenceKo": "왼날개→오른날개→광전 코어",
      "canvas": [
        48,
        40
      ],
      "pivot": [
        24,
        36
      ],
      "paletteFile": "art-source/issue-45-r5-r6/palettes/r05_orbit16.gpl",
      "scalePolicy": "integer_nearest",
      "status": "production_ready",
      "sourceFile": "art-source/issue-45-r5-r6/originals/enemy_r05_panel_butterfly.png",
      "imagegenCallArtifacts": [
        "exec-3cf2458c-9e02-4287-998b-ffba161c2a4c.png"
      ],
      "transparentFile": "art-source/issue-45-r5-r6/transparent/enemy_r05_panel_butterfly.png",
      "file": "art-export/issue-45-r5-r6/production/enemy_r05_panel_butterfly.png",
      "sourceSha256": "b1a3b7f6cf786547019f289349646ee370959e281fd4cf6c2eaf5997ce6f2e09",
      "sha256": "9c37dae639699bebb0e52cb8e37ed5c01c4fabfa838a4f7ec1adb6a9b3444c62",
      "verified": {
        "officialChromaHelper": true,
        "transparentEdgePixels": 7992,
        "transparentCorners": true,
        "greenFringePixels": 0,
        "binaryAlpha": true,
        "strictPalette": true
      },
      "transparentSha256": "acfb7592b716b30bdef5ecf49d1d8eeffea2fbc26d90c8e8aa0e685d88acc06e"
    },
    {
      "id": "enemy_r05_antenna_mantis",
      "regionId": "r05",
      "entityId": "antenna_mantis",
      "nameKo": "안테나사마귀",
      "nameEn": "Antenna Mantis",
      "class": "normal",
      "kind": "enemy_medium",
      "behaviorId": "antenna_beam",
      "behaviorKo": "안테나 집게 빔",
      "weakness": "cut",
      "secondaryWeaknesses": [],
      "breakSequenceKo": "안테나→집게→송신기",
      "canvas": [
        48,
        48
      ],
      "pivot": [
        24,
        43
      ],
      "paletteFile": "art-source/issue-45-r5-r6/palettes/r05_orbit16.gpl",
      "scalePolicy": "integer_nearest",
      "status": "production_ready",
      "sourceFile": "art-source/issue-45-r5-r6/originals/enemy_r05_antenna_mantis.png",
      "imagegenCallArtifacts": [
        "exec-25c4303d-7662-477a-b4dc-2b754a291d12.png"
      ],
      "transparentFile": "art-source/issue-45-r5-r6/transparent/enemy_r05_antenna_mantis.png",
      "file": "art-export/issue-45-r5-r6/production/enemy_r05_antenna_mantis.png",
      "sourceSha256": "fb84df934617d175e026bdccdb3547bbf8a8b46b683eac6f188c4fbfc0f52837",
      "sha256": "c36cd41fa7595dcabe7da06c86575cd76fefa1527aa6f412d3493a78c8e96668",
      "verified": {
        "officialChromaHelper": true,
        "transparentEdgePixels": 18748,
        "transparentCorners": true,
        "greenFringePixels": 0,
        "binaryAlpha": true,
        "strictPalette": true
      },
      "transparentSha256": "dd328d919bf9433726a24570c941c5b667716dae80b4a0eb1f08e38b7019b9f7"
    },
    {
      "id": "enemy_r05_capsule_turtle",
      "regionId": "r05",
      "entityId": "capsule_turtle",
      "nameKo": "캡슐거북",
      "nameEn": "Capsule Turtle",
      "class": "normal",
      "kind": "enemy_medium",
      "behaviorId": "capsule_reentry",
      "behaviorKo": "재진입 가열 돌진",
      "weakness": "cooling",
      "secondaryWeaknesses": [],
      "breakSequenceKo": "열차폐판→캡슐 문→코어",
      "canvas": [
        48,
        48
      ],
      "pivot": [
        24,
        43
      ],
      "paletteFile": "art-source/issue-45-r5-r6/palettes/r05_orbit16.gpl",
      "scalePolicy": "integer_nearest",
      "status": "production_ready",
      "sourceFile": "art-source/issue-45-r5-r6/originals/enemy_r05_capsule_turtle.png",
      "imagegenCallArtifacts": [
        "exec-658e9c7a-6236-4de3-a61d-796090ba1ed2.png"
      ],
      "transparentFile": "art-source/issue-45-r5-r6/transparent/enemy_r05_capsule_turtle.png",
      "file": "art-export/issue-45-r5-r6/production/enemy_r05_capsule_turtle.png",
      "sourceSha256": "39d8d8ddd980b06d0f86963992a6408ea45daed812bcc02bbb78cec50bbb4885",
      "sha256": "a4f5afc93a5de3a407a7949041b1e784551b370332e1fbdb305556c6b0ed6d34",
      "verified": {
        "officialChromaHelper": true,
        "transparentEdgePixels": 6314,
        "transparentCorners": true,
        "greenFringePixels": 0,
        "binaryAlpha": true,
        "strictPalette": true
      },
      "transparentSha256": "0c9fdfa17ecc5efb61e5309416e53cc56eb55755d672eeb30e5f3037d326119d"
    },
    {
      "id": "enemy_r05_rocket_mole",
      "regionId": "r05",
      "entityId": "rocket_mole",
      "nameKo": "로켓두더지",
      "nameEn": "Rocket Mole",
      "class": "normal",
      "kind": "enemy_medium",
      "behaviorId": "zero_g_burrow",
      "behaviorKo": "잔해 뒤 잠복",
      "weakness": "electric",
      "secondaryWeaknesses": [],
      "breakSequenceKo": "노즐→드릴 코→연료전지",
      "canvas": [
        48,
        48
      ],
      "pivot": [
        24,
        43
      ],
      "paletteFile": "art-source/issue-45-r5-r6/palettes/r05_orbit16.gpl",
      "scalePolicy": "integer_nearest",
      "status": "production_ready",
      "sourceFile": "art-source/issue-45-r5-r6/originals/enemy_r05_rocket_mole.png",
      "imagegenCallArtifacts": [
        "exec-75f97246-7b2b-46e7-b8e9-c26c04ac3205.png"
      ],
      "transparentFile": "art-source/issue-45-r5-r6/transparent/enemy_r05_rocket_mole.png",
      "file": "art-export/issue-45-r5-r6/production/enemy_r05_rocket_mole.png",
      "sourceSha256": "8252b698c1d1df80f41daa96433be9bcaad3c1c055e2d347faa5273683479a51",
      "sha256": "b128ab34a596e3894dd2a291d5c8ed21fe1c0fb110a756858485215a6a5cfacc",
      "verified": {
        "officialChromaHelper": true,
        "transparentEdgePixels": 11817,
        "transparentCorners": true,
        "greenFringePixels": 0,
        "binaryAlpha": true,
        "strictPalette": true
      },
      "transparentSha256": "6ef219d41b62f61e1360e3425970eaf3e6d8cc58f0d3a2ba27eff8ca00cc0a65"
    },
    {
      "id": "elite_r05_docking_golem",
      "regionId": "r05",
      "entityId": "docking_golem",
      "nameKo": "도킹골렘",
      "nameEn": "Docking Golem",
      "class": "elite",
      "kind": "enemy_large",
      "behaviorId": "paired_docking_arms",
      "behaviorKo": "좌우 도킹 암 동시 파괴",
      "weakness": "cut",
      "secondaryWeaknesses": [],
      "breakSequenceKo": "두 암을 3초 안에→중앙 포트",
      "canvas": [
        64,
        64
      ],
      "pivot": [
        32,
        58
      ],
      "paletteFile": "art-source/issue-45-r5-r6/palettes/r05_orbit16.gpl",
      "scalePolicy": "integer_nearest",
      "status": "production_ready",
      "sourceFile": "art-source/issue-45-r5-r6/originals/elite_r05_docking_golem.png",
      "imagegenCallArtifacts": [
        "exec-66d27ed5-2350-424a-964c-623b04b050a5.png"
      ],
      "transparentFile": "art-source/issue-45-r5-r6/transparent/elite_r05_docking_golem.png",
      "file": "art-export/issue-45-r5-r6/production/elite_r05_docking_golem.png",
      "sourceSha256": "4ace70c5e0c1b87444390e1833a250335ef83faffb3567b97da63e07730ecc36",
      "sha256": "ae4ef2e4a4cb4b913d9692024ee59d56d1a0693364f2693d311a247e6416d14b",
      "verified": {
        "officialChromaHelper": true,
        "transparentEdgePixels": 11514,
        "transparentCorners": true,
        "greenFringePixels": 0,
        "binaryAlpha": true,
        "strictPalette": true
      },